{
  "id": "slides.pitch.product_v1",
  "title": "Product pitch deck",
  "version": "1.0.0",
  "task_family": "slides",
  "task_type": "pitch_deck",
  "set": "capability",
  "description": "Create a persuasive product pitch deck for enterprise buyers.",
  "question": {
    "query": "Create a 9-11 slide enterprise sales pitch deck for a browser-based AI agent platform. The deck should cover the customer problem, product workflow, differentiators, proof points, security posture, rollout plan, and close with a clear ask.",
    "query_chinese": "为一个基于浏览器的 AI agent 平台制作一份 9-11 页的企业销售 pitch PPT。PPT 应覆盖客户问题、产品工作流、差异化优势、证明点、安全姿态、推广计划，并以明确请求收尾。",
    "browser_initial_state": {
      "url": "about:blank",
      "auth_state": "not_required",
      "local_files": []
    },
    "attachments": []
  },
  "output_contract": {
    "required_artifacts": [
      { "id": "deck", "kind": "pptx", "extension": ".pptx", "required": true }
    ],
    "final_report": { "required": true }
  },
  "success_threshold": 0.75,
  "grader_files": [
    "graders/deck_exists.json",
    "graders/pitch_structure.json",
    "graders/pitch_quality.prompt.md"
  ],
  "metadata": {
    "owner": "slides"
  }
}
