{
  "id": "slides.data_story.qbr_v1",
  "title": "QBR data story deck",
  "version": "1.0.0",
  "task_family": "slides",
  "task_type": "data_presentation",
  "set": "capability",
  "description": "Create an executive QBR deck from operating metrics.",
  "question": {
    "query": "Create a 10-12 slide QBR deck for executives using the attached operating metrics. Highlight growth, retention risk, funnel efficiency, and next-quarter actions. Include at least two charts, one summary table, and a clear recommendation section.",
    "query_chinese": "使用附件中的运营指标，为高管制作一份 10-12 页的 QBR PPT。突出增长、留存风险、漏斗效率和下一季度行动。至少包含两个图表、一个摘要表格，以及一个清晰的建议部分。",
    "browser_initial_state": {
      "url": "about:blank",
      "auth_state": "not_required",
      "local_files": ["attachments/qbr_metrics.csv"]
    },
    "attachments": [
      {
        "name": "qbr_metrics.csv",
        "kind": "csv",
        "path": "attachments/qbr_metrics.csv",
        "description": "Quarterly ARR, churn, NRR, pipeline, conversion, and segment metrics."
      }
    ]
  },
  "output_contract": {
    "required_artifacts": [
      { "id": "deck", "kind": "pptx", "extension": ".pptx", "required": true }
    ],
    "final_report": { "required": true }
  },
  "success_threshold": 0.78,
  "grader_files": [
    "graders/deck_exists.json",
    "graders/deck_structure.json",
    "graders/data_story_quality.prompt.md",
    "graders/workflow_signals.json"
  ],
  "metadata": {
    "owner": "slides",
    "promotion_criteria": "Promote to regression after three consecutive pass^3 runs across two model versions."
  }
}
